,вопрос,класс
3418,относиться дополнительный поле счёт получатель,1
3419,формирование технический изменение контракт необходимо,1
3420,список зарегистрировать контракт выделить необходимый,1
3421,запись панель инструмент нажать кнопка,1
3422,сформировать технический изменение рисунок сформировать,1
3423,новый редакция контракт тип изменить,1
3424,номер изменение увеличить значение вновь,1
3425,сформировать редакция стать доступный дальнейший,1
3426,редактирование папка контракт фильтр доработка,1
3427,рисунок случай необходимо отразить переброска,1
3428,финансирование необходимо открыть форма контракт,1
3429,вкладка график финансирование зависимость средство,1
3430,происходить финансирование добавление новый строка,1
3431,воспользоваться кнопка копировать создать копия,1
3432,строка основа произвести копирование рисунок,1
3433,вновь скопировать строка возможность скорректировать,1
3434,выбрать иной счёт получатель изменить,1
3435,сумма выплата новый рисунок выплата,1
3436,первоначально запланировать производиться финансирование предполагаться,1
3437,провести новый строка предыдущий удалять,1
3438,затирать необходимо обнулить создать новый,1
3439,строка весь объём финансирование пример,1
3440,выше показать переброска средство частичный,1
3441,финансирование предыдущий остаться объём финансирование,1
3442,новый сохранение контракт система проверить,1
3443,дать неизменность общий объём финансирование,1
3444,изменение объём финансирование обязательно необходимо,1
3445,отразить еис использоваться механизм формирование,1
3446,изменение контракт никак технический изменение,1
3447,внесение необходимый исправление следовать сохранить,1
3448,документ кнопка сохранить перевод контракт,1
3449,находиться режим технический изменение фильтр,1
3450,зарегистрировать использоваться кнопка зарегистрировать рисунок,1
3451,дать кнопка перевод зарегистрировать состояние,1
3452,доступный фильтр доработка изменение следовать,1
3453,отправить база исполнение бюджет качество,1
3454,следующий изменение ранее передать контракт,1
3455,передача сведение заключить контракт бюджет,1
3456,smart производиться зависимость регион кнопка,1
3457,сформировать бкс 98н рисунок документ,1
3458,предварительный заявка закупка исключить учёт,1
3459,база исполнение бюджет самый высвободиться,1
3460,средство зарезервированный проведение процедура размещение,1
3461,государственный заказ высвободить средство зарезервировать,1
3462,сумма заключить контракт дальнейший передать,1
3463,сведение заключение контракт сформировать бюджетный,1
3464,обязательство заявка бюджетополучатель зависимость регион,1
3465,исполнение контракт разница заложить сумма,1
3466,сумма заключение контракт являться экономия,1
3467,случай использование кнопка сформировать бкс,1
3468,98н система исполнение бюджет сразу,1
3469,основа сведение заключить контракт сформировать,1
3470,передача документ контракт точно случай,1
3471,передача контракт средство предварительный заявка,1
3472,закупка высвободить сумма заключить контракт,1
3473,зарезервировать основа сформировать дальнейший проходить,1
3474,оплата заключить контракт система доступный,1
3475,механизм загрузка ранее опубликовать еис,1
3476,сведение заключить контракт заказчик данный,1
3477,механизм рассчитать регион середина год,1
3478,переходить работа система случай форс,1
3479,мажор интеграция еис функционал позволять,1
3480,загрузить первичный сведение заключить контракт,1
3481,изменение сведение заключить контракт случай,1
3482,еис загружаться максимально доступный загрузка,1
3483,редакция сведение заключить контракт загрузка,1
3484,сведение заключить контракт возможный следующий,1
3485,день размещение еис момент размещение,1
3486,сведение заключить контракт еис момент,1
3487,подача заявка загрузка должный пройти,1
3488,менее день иначе дать подгрузить,1
3489,сила сведение разместить данные выгружаться,1
3490,еис следующий день размещение создание,1
3491,заявка загрузка контракт еис достаточно,1
3492,перейти документ заявка заказчик загрузка,1
3493,контракт еис нажать кнопка создать,1
3494,рисунок открыться электронный форма сведение,1
3495,организация заказчик заполнить автоматически рисунок,1
3496,таблица перечень документ возможность перечислить,1
3497,контракт следовать загрузить еис кнопка,1
3498,добавить строка необходимо создать пустой,1
3499,строка поле реестровый номер документ,1
3500,ввести реестровый номер заключить разместить,1
3501,еис контракт поле реестровый номер,1
3502,документ должный занести реестровый номер,1
3503,контракт заявка заказчик загрузка контракт,1
3504,добавить перечень контракт следовать загрузить,1
3505,допускаться занесение реестровый номер запятая,1
3506,поле каждый контракт следовать добавить,1
3507,отдельный строка указать немой реестровый,1
3508,номер контракт внесение необходимый реестровый,1
3509,номер заявка загрузка следовать сохранить,1
3510,кнопка сохранить сохранить заявка заказчик,1
3511,загрузка доступный список документ заявка,1
3512,заказчик загрузка контракт еис состояние,1
3513,регистрация рисунок заявка загрузка контракт,1
3514,еис доступный следующий состояние регистрация,1
3515,зарегистрировать загрузить еис зарегистрировать зарегистрировать,1
3516,заявка обработать зарегистрировать найти еис,1
3517,статус регистрация информировать документ успешно,1
3518,создать заказчик ожидать регистрация администратор,1
3519,система статус зарегистрировать информировать заявка,1
3520,загрузка зарегистрировать администратор система процесс,1
3521,загрузка запустить требоваться дождаться результат,1
3522,обработка заявка загрузка статус загрузить,1
3523,еис зарегистрировать информировать сведение контракт,1
3524,указанный заявка заказчик успешно загрузить,1
3525,система статус зарегистрировать заявка обработать,1
3526,информировать среди сведение контракт отражённый,1
3527,заявка загрузка присутствовать запись иной,1
3528,причина произвести загрузка контракт статус,1
3529,зарегистрировать найти еис информировать весь,1
3530,сведение контракт отражённый заявка загрузка,1
3531,информация найти еис подобный возможно,1
3532,случай указание неверный реестровый номер,1
3533,контракт следовать проверить реестровый номер,1
3534,создать новый заявка загрузка указать,1
3535,верный значение заявка загрузка контракт,1
3536,еис поле статус каждый запись,1
3537,реестровый номер контракт записать значение,1
3538,результат обработка рисунок возможный следующий,1
3539,статус обработка ожидаться загрузка документ,1
3540,загрузить документ найти документ присутствовать,1
3541,база совпадение реестровый номер икз,1
3542,документ принадлежать дать корреспондент статус,1
3543,ожидаться загрузка устанавливаться автоматически каждый,1
3544,запись сохранение заявка загрузка контракт,1
3545,статус документ загрузить информировать сведение,1
3546,заключить контракт дать реестровый номер,1
3547,успешно загрузить система статус документ,1
3548,найти информировать ввести реестровый номер,1
3549,удаться обнаружить опубликовать контракт еис,1
3550,случай требоваться проверить реестровый номер,1
3551,контракт создать новый заявка загрузка,1
3552,статус документ присутствовать база совпадение,1
3553,реестровый номер икз информировать система,1
3554,существовать контракт реестровый номер икз,1
3555,статус документ принадлежать дать корреспондент,1
3556,информировать ввести реестровый номер контракт,1
3557,соответствовать организация имя создать заявка,1
3558,загрузка успешно загрузить еис контракт,1
3559,доступный папка контракт фильтр зарегистрировать,1
3560,электронный актирование обмен документ приёмка,1
3561,товар работа услуга исполнение государственный,1
3562,муниципальный контракт соответствие закон электронный,1
3563,формат посредством функционал личный кабинет,1
3564,заказчик поставщик еис рамка исполнение,1
3565,контракт предусмотреть возможность работа документ,1
3566,приёмка корректировочный документ подтверждать факт,1
3567,передача товар любой имущество кроме,1
3568,объект недвижимость транспортировка передача товар,1
3569,заказчик доверенный лицо факт передача,1
3570,товар транспортировка передача товар заказчик,1
3571,доверенный лицо либо иной лицо,1
3572,привлечь транспортировка товар факт оказание,1
3573,услуга факт передача результат выполнить,1
3574,работа формирование документ приёмка счёт,1
3575,фактура корректировочный документ корректировочный счёт,1
3576,фактура осуществляться поставщик личный кабинет,1
3577,участник закупка подписание направление документ,1
3578,должностной лицо уполномоченный подписание направлять,1
3579,сведение сторона поставщик документ отображаться,1
3580,личный кабинет заказчик реестр документ,1
3581,исполнение контракт загружаться система становиться,1
3582,доступный просмотр заказчик раздел электронный,1
3583,актирование первичный тип документ электронный,1
3584,актирование система счёт фактура счёт,1
3585,фактура документ передача документ передача,1
3586,вторичный тип документ электронный актирование,1
3587,система корра счёт фактура корра,1
3588,счёт фактура документ изменение стоимость,1
3589,документ изменение стоимость ниже отобразить,1
3590,дерево объект электронный актирование рисунок,1
3591,исполнение контракт содержать сведение выполнить,1
3592,обязательство поставщик контракт предусматривать электронный,1
3593,актирование еис загружаться система автоматический,1
3594,режим следующий день размещение исполнение,1
3595,контракт еис документ доступный просмотр,1
3596,фильтр зарегистрировать сведение исполнение обязательство,1
3597,заказчик контракт сведение исполнение контракт,1
3598,предусмотреть электронный актирование еис формироваться,1
3599,система согласно ниже изложить инструкция,1
3600,включение сведение исполнение расторжение контракт,1
3601,реестр контракт заказчик формировать система,1
3602,документ исполнение контракт рисунок доступный,1
3603,навигатор следующий состояние создание новый,1
3604,технический изменеий принять еис зарегистрировать,1
3605,отменить создание документ исполнение контракт,1
3606,необходимо найти папка одноимённый название,1
3607,исполнение контракт открыть фильтр создание,1
3608,новый нажать кнопка информация исполнение,1
3609,расторжение контракт 2015 рисунок электронный,1
3610,форма документ необходимо выбрать номер,1
3611,реестровый запись список зарегистрировать контракт,1
3612,открываться новый окно кнопка вызов,1
3613,справочник рисунок открыться справочник двойной,1
3614,щелчок лкм выбирать контракт предполагаться,1
3615,создание исполнение контракт рисунок заголовок,1
3616,документ флаг исполнение контракт этап,1
3617,контракт завершить выставляться случай текущий,1
3618,документ предусматривать завершение исполнение контракт,1
3619,завершение исполнение рамка выбрать этап,1
3620,контракт образ данный флаг выставляться,1
3621,исполнение контракт являться подтверждение частичный,1
3622,исполнение контракт частичный исполнение этап,1
3623,контракт каждый этап контракт документ,1
3624,исполнение контракт отметить флаг исполнение,1
3625,контракт этап контракт завершить пример,1
3626,контракт предусмотреть разбивка этап 000,1
3627,руб каждый формироваться исполнение контракт,1
3628,этап сумма 000 руб данный,1
3629,случай документ исполнение контракт обеспечивать,1
3630,полный исполнение документ 000 руб,1
3631,поэтому флаг исполнение контракт этап,1
3632,контракт завершить устанавливаться документ исполнение,1
3633,контракт предполагать исполнение контракт сумма,1
3634,этап 000 руб флаг метка,1
3635,исполнение контракт этап контракт завершить,1
3636,нужно установить выбор контракт предполагаться,1
3637,создание исполнение контракт блок сведение,1
3638,контракт заполняться автоматически основа данные,1
3639,документ контракт поле этап контракт,1
3640,выбираться список этап исполнение предусмотреть,1
3641,контракт рисунок запись выделить жёлтый,1
3642,цвет информировать исполнение контракт завершить,1
3643,провести частичный исполнение этап контракт,1
3644,запись выделить светло зелёный цвет,1
3645,информировать этап контракт исполнить сумма,1
3646,указанный контракт подсветить этап контракт,1
3647,информировать отсутствие зарегистрировать исполнение контракт,1
3648,этап окно редактирование исполнение контракт,1
3649,состоять заголовочный часть следовать указать,1
3650,дата регистрация номер реестровый запись,1
3651,контракт этап контракт выбираться список,1
3652,заполнить этап контракт номер исполнение,1
3653,рамка контракт следующий раздел исполнение,1
3654,контракт отсрочка списание неустойка штраф,1
3655,пеня независимый гарантия информация неустойка,1
3656,штраф пеня расторжение контракт исполнение,1
3657,обязательство гарантия качество финансирование сведение,1
3658,удержание денежный средство информация возврат,1
3659,переплата контракт изменение вкладка исполнение,1
3660,контракт блок документ исполнение контракт,1
3661,заполняться информация документ подтверждать исполнение,1
3662,контракт кнопка добавить строка добавляться,1
3663,новый строка заполнение поле наименование,1
3664,документ следовать двойной щелчок мышь,1
3665,дать поле вызвать справочник тип,1
3666,документ исполнение контракт рисунок выбрать,1
3667,необходимый тип документ вновь добавить,1
3668,строка доступный заполнение следующий поле,1
3669,рисунок наименование документ заполняться выбор,1
3670,значение справочник тип документ исполнение,1
3671,контракт номер документ дата документ,1
3672,дата подписание заказчик документ приёмка,1
3673,товар работа услуга доступно документ,1
3674,приёмка дата время подписание заказчик,1
3675,документ приёмка товар работа услуга,1
3676,электронный вид заполняться автоматически загрузка,1
3677,исполненийконтракт еис стоимость исполнить поставщик,1
3678,обязательство заполняться автоматически основа внести,1
3679,сведение объём исполнить обязательство валюта,1
3680,платёж информация ненадлежащий исполнение неисполнение,1
3681,контракт число часть оплата сведение,1
3682,объём характеристика поставить товар выполнить,1
3683,работа оказать услуга случай закупка,1
3684,товар работа услуга доступно документ,1
3685,приёмка сведение объём характеристика поставить,1
3686,товар выполнить работа оказать услуга,1
3687,лекарственный препарат доступный заполнение случай,1
3688,закупка лекарственный препарат документ приёмка,1
3689,идентификатор документ еис внешний идентификатор,1
3690,документ вложение сведение приёмка производить,1
3691,расчёт ндс редактировать поле значение,1
3692,приходить еис ставка ндс редактировать,1
3693,поле значение приходить еис сумма,1
3694,ндс редактировать поле значение приходить,1
3695,еис выбрать документ исполнение контракт,1
3696,являться документ приёмка доступный возможность,1
3697,заполнение сведение объём характеристика поставлять,1
3698,товар выполнять работа оказывать услуга,1
