,вопрос,класс
10594,реабилитация риск пациент например разработка,0
10595,робот хирург позволить проводить сложный,0
10596,хирургический процедура максимальный точность минимальный,0
10597,вмешательство человек открывать новый возможность,0
10598,успешный лечение заболевание увеличивать выживаемость,0
10599,пациент инновационный подход медицинский технология,0
10600,включать разработка использование мобильный приложение,0
10601,устройство учёт здоровье самомониторинг приложение,0
10602,позволять человек следить здоровье позволять,0
10603,доступный персонализировать медицинский помощь предоставлять,0
10604,информация состояние здоровье вести учёт,0
10605,физический активность калорийность пища фактор,0
10606,влиять общий состояние организм благодаря,0
10607,инновационный подход человек мочь предотвращать,0
10608,заболевание поддерживать здоровье получать быстрый,0
10609,медицинский помощь необходимость инновационный подход,0
10610,медицинский технология играть огромный роль,0
10611,развитие современный медицина благодаря врач,0
10612,иметь хороший инструмент точный диагностика,0
10613,лечение пациент получать быстрый эффективный,0
10614,медицинский помощь технология продолжать развиваться,0
10615,открывать новый горизонт медицина помогать,0
10616,спасти жизнь улучшить качество жизнь,0
10617,человек расизм дискриминация главный проблема,0
10618,мир сталкиваться ежедневно дискриминация основать,0
10619,предрассудок стереотип непонимание создавать неравный,0
10620,несправедливый мир некоторый человек получать,0
10621,привилегия возможность основа раса национальность,0
10622,пол сексуальный ориентация инвалидность противодействие,0
10623,расизм дискриминация являться наиболее актуальный,0
10624,важный задача общество требовать коллективный,0
10625,усилие уровень государственный институция каждый,0
10626,индивид поддержка осведомлённость образование относительно,0
10627,проблема являться ключевой шаг борьба,0
10628,дискриминация образовательный учреждение например должный,0
10629,включать программа культурология история разный,0
10630,народ расширить кругозор ученик показать,0
10631,человек равный государственный орган должный,0
10632,принимать специальный закон политика обеспечивать,0
10633,равноправие гражданин включать создание специальный,0
10634,комиссия агентство заниматься борьба дискриминация,0
10635,расизм защищать право пострадать борьба,0
10636,проблема ограничиваться лишь деятельность государственный,0
10637,орган каждый индивид должный принять,0
10638,ответственность стать активный участник противодействие,0
10639,расизм дискриминация осведомлённость публичный выступление,0
10640,поддержка некоммерческий организация обеспечивать помощь,0
10641,правовой защита пострадать дискриминация исключение,0
10642,расизм дискриминация общество требовать время,0
10643,усилие иметь потенциал создать гармоничный,0
10644,справедливый общество принимать ценить разнообразие,0
10645,уникальный качество каждый человек открывать,0
10646,дверь сотрудничество взаимный уважение равный,0
10647,возможность образ совместный усилие приоритетный,0
10648,внимание проблема мочь преодолеть расизм,0
10649,дискриминация общество создать справедливый мир,0
10650,альтернативный источник энергия играть важный,0
10651,роль мир сегодня представлять потенциальный,0
10652,решение проблема исчерпание традиционный ископаемое,0
10653,источник энергия проблема экологический загрязнение,0
10654,вызвать производство энергия самый известный,0
10655,альтернативный источник энергия являться солнечный,0
10656,энергия получаться солнечный излучение превратить,0
10657,электрический тепловой энергия перспектива солнечный,0
10658,энергия обещать весьма благоприятный солнце,0
10659,бесконечный источник энергия доступный практически,0
10660,повсеместно кроме развитие технология использование,0
10661,солнечный энергия ускоряться делать экономически,0
10662,привлекательный перспективный альтернативный источник энергия,0
10663,являться ветряный энергия получаться благодаря,0
10664,движение воздушный масса приводить действие,0
10665,ветряный турбина ветряный энергия считаться,0
10666,экологически чистый источник энергия потенциал,0
10667,значительно высокий основный недостаток являться,0
10668,необходимость наличие сильный ветровый поток,0
10669,делать использование нерентабельный некоторый район,0
10670,интересный направление область альтернативный источник,0
10671,энергия являться гидроэнергетик основать использование,0
10672,движение вода например речной приливный,0
10673,поток создание электроэнергия гидроэнергетик иметь,0
10674,значительный потенциал являться стабильный источник,0
10675,энергия сожаление необходимость строительство гидроэлектростанция,0
10676,вызывать негативный экологический эффект например,0
10677,изменение речной экосистема перспективный альтернативный,0
10678,источник энергия являться геотермальный энергия,0
10679,использовать тепло накапливаться внутри земля,0
10680,генерация электричество геотермальный энергия пригодный,0
10681,производство электроэнергия практически везде использовать,0
10682,необходимо провести специальный буровая работа,0
10683,ограничивать использование некоторый район целое,0
10684,альтернативный источник энергия иметь большой,0
10685,потенциал замена ископаемое источник энергия,0
10686,добиться полный переориентация необходимо продолжать,0
10687,исследование развитие технология область смочь,0
10688,обеспечить стабильный экологически чистый источник,0
10689,энергия будущий поколение интеллектуальный собственность,0
10690,играть ключевой роль инновационный экономика,0
10691,обеспечивать защита стимулировать инновационный процесс,0
10692,представлять результат творческий человек включать,0
10693,изобретение литературный художественный произведение промышленный,0
10694,образец дизайн основный функция интеллектуальный,0
10695,собственность являться защита право инноватор,0
10696,позволять сохранить контроль идея продукт,0
10697,технология защита право интеллектуальный собственность,0
10698,создавать условие справедливый конкуренция способствовать,0
10699,развитие инновация стимулировать инвестиция научно,0
10700,исследовательский деятельность способствовать создание новый,0
10701,рабочий место иметь защитить право,0
10702,изобретение инновация предприниматель мочь безопасно,0
10703,вкладывать средство разработка коммерциализация результат,0
10704,интеллектуальный собственность стимулировать инновационный активность,0
10705,помогать создавать новый товар технология,0
10706,услуга очередь способствовать экономический рост,0
10707,развитие кроме интеллектуальный собственность являться,0
10708,важный составлять международный торговля право,0
10709,интеллектуальный собственность мочь объект продажа,0
10710,лицензирование позволять предприятие использовать инновация,0
10711,страна получать доход операция способствовать,0
10712,глобализация инновация позволять компания выходить,0
10713,новый рынок увеличивать конкурентоспособность привлекательность,0
10714,инвестор образ роль значение интеллектуальный,0
10715,собственность инновационный экономика трудно переоценить,0
10716,защищать право инноватор стимулировать инновационный,0
10717,активность обеспечивать экономический рост способствовать,0
10718,развитие международный торговля поэтому правильный,0
10719,охрана управление интеллектуальный собственность являться,0
10720,важный задача должный реализовать уровень,0
10721,государство уровень бизнес реклама играть,0
10722,значимый роль современный потребительский культура,0
10723,оказывать существенный влияние поведение предпочтение,0
10724,восприятие мир создавать формировать потребность,0
10725,определять считать желаемый необходимый счастливый,0
10726,успешный жизнь влияние реклама потребительский,0
10727,поведение начинаться ранний детство ребёнок,0
10728,открывать новый продукт игрушка идея,0
10729,яркий привлекательный рекламный ролик реклама,0
10730,создавать импульс покупка влиять формирование,0
10731,желание вкус будущее взрослый мочь,0
10732,избежать воздействие реклама проникать повседневный,0
10733,жизнь телевизор радио интернет социальный,0
10734,сеть метро уличный реклама реклама,0
10735,пытаться убедить непременный необходимость приобретение,0
10736,определённый продукт услуга обещать благосостояние,0
10737,успех свобода привлекательность компания бренд,0
10738,вкладывать значительный средство маркетинговый кампания,0
10739,привлечь внимание потребитель убедить купить,0
10740,товар использовать великолепный оформление эмоциональный,0
10741,история знаменитость определённый цвет привлечь,0
10742,удержать внимание образ реклама влиять,0
10743,потребительский поведение влияние реклама разделить,0
10744,несколько аспект первый реклама создавать,0
10745,потребность определённый товар услуга раскрывать,0
10746,преимущество выгода мочь получить побуждать,0
10747,покупать становиться убедить товар смочь,0
10748,счастливый успешный второй реклама формировать,0
10749,восприятие реальность предлагать определённый образ,0
10750,стандарт красота способ жизнь счастие,0
10751,начинать воспринимать норма воздействие реклама,0
10752,мочь покупать вещь дело нужный,0
10753,тратить деньга мочь позволить соответствовать,0
10754,образ третий реклама создавать лояльность,0
10755,бренд постоянно видеть реклама определённый,0
10756,товар услуга развивать привязанность предпочтение,0
10757,становиться верный потребитель несмотря возможный,0
10758,хороший альтернатива необходимо помнить реклама,0
10759,искажённый манипулятивный использовать приём трюк,0
10760,создать иллюзия польза представить товар,0
10761,хороший свет поэтому важно осведомить,0
10762,аналитический потребитель принимать обоснованный решение,0
10763,покупка целое реклама оказывать существенный,0
10764,воздействие потребительский поведение иметь возможность,0
10765,контролировать поведение выборы осознавать реальный,0
10766,потребность отличать рекламный иллюзия реальность,0
10767,толерантность взаимопонимание играть ключевой роль,0
10768,установление поддержание межкультурный отношение мир,0
10769,человек разный культура национальность религия,0
10770,пересекаться необходимость понимание уважение друг,0
10771,друг становиться актуальный толерантность способность,0
10772,принимать уважать человек несмотря отличие,0
10773,основной фундамент межкультурный коммуникация сотрудничество,0
10774,проявлять толерантность открывать дверь понимание,0
10775,доверие человек культура существенно способствовать,0
10776,строительство межкультурный отношение толерантность существовать,0
10777,взаимопонимание взаимопонимание межкультурный отношение означать,0
10778,готовность разобраться культурный особенность человек,0
10779,принять мироощущение понять почему действовать,0
10780,делать взаимопонимание помогать создать мост,0
10781,разный мировоззрение способствовать сотрудничество совместный,0
10782,развитие развить толерантность взаимопонимание межкультурный,0
10783,отношение важный обоюдный заинтересованность познание,0
10784,принятие культура включать изучение язык,0
10785,обычай верование активный общение слушание,0
10786,человек необходимо открыться новый идея,0
10787,готовый изменение установка предрассудок важно,0
10788,осознавать собственный культурный особенность готовый,0
10789,разделение знание межкультурный отношение мочь,0
10790,сложный противоречивый толерантность взаимопонимание ключ,0
10791,построение гармоничный равноправный общество учиться,0
10792,уважать друг друг понимать каждый,0
10793,культура иметь ценность достоинство открывать,0
10794,возможность совместный рост развитие необходимо,0
10795,стремиться толерантность взаимопонимание стать неотъемлемый,0
10796,часть жизнь основа межкультурный диалог,0
10797,строительство мир человек мочь жить,0
10798,гармония справедливость цифровизация современный информационный,0
10799,технология играть важный роль жизнь,0
10800,охватывать сфера деятельность экономика образование,0
10801,здравоохранение государственный управление становиться неотъемлемый,0
10802,часть общество преобразовать образ жизнь,0
10803,рабочий процесс цифровизация процесс переход,0
10804,аналоговый форма передача информация цифровой,0
10805,означать дать кодироваться передаваться вид,0
10806,битов обеспечивать надёжный удобный передача,0
10807,хранение информация главный достижение цифровизация,0
10808,являться интернет обеспечивать связь доступ,0
10809,информация любой точка мир современный,0
10810,информационный технология искусственный интеллект облачный,0
10811,вычисление интернет вещь big data,0
10812,предоставлять огромный возможность улучшение бизнес,0
10813,процесс оптимизация ресурс обеспечение рост,0
10814,экономика помогать автоматизировать рутинный задача,0
10815,увеличивать производительность улучшать качество услуга,0
10816,продукт способствовать разработка инновация быстрый,0
10817,рост цифровой технология приводить изменение,0
10818,образовательный сфера становиться необходимость включение,0
10819,информационный технология учебный процесс студент,0
10820,мочь развивать навык работа цифровой,0
10821,инструмент анализировать больший объём данные,0
10822,кроме цифровой технология позволять доступ,0
10823,образование удалённый онлайн курс образовательный,0
10824,платформа создавать равный возможность цифровизация,0
10825,современный информационный технология вносить некоторый,0
10826,вызов проблема являться вопрос безопасность,0
10827,данные утечка кража информация становиться,0
10828,распространить поэтому необходимо внедрение средство,0
10829,защита информация обеспечение конфиденциальность заключение,0
10830,цифровизация современный информационный технология являться,0
10831,неотъемлемый часть современный общество преобразовать,0
10832,повседневный жизнь оказывать значительный влияние,0
10833,экономика образование здравоохранение область создавать,0
10834,новый возможность вызов поэтому важно,0
10835,внимательный готовый адаптироваться быстро меняться,0
10836,технология охрана окружающий среда устойчивый,0
10837,развитие являться наиболее актуальный проблема,0
10838,современность каждый год человечество сталкиваться,0
10839,рост экологический проблема негативно влиять,0
10840,планета жизнь целое охрана окружающий,0
10841,среда сохранение восстановление природный ресурс,0
10842,защита биологический разнообразие сокращение загрязнение,0
10843,окружающий среда важно благополучие сегодня,0
10844,будущий поколение главный экологический проблема,0
10845,современность являться загрязнение окружающий среда,0
10846,промышленный выброс отход использование пластиковый,0
10847,материал стать серьёзный угроза природа,0
10848,живой организм отсутствие контроль выброс,0
10849,вредный вещество приводить изменение климат,0
